{
  "schema_version": "1.0",
  "id": "agents-modernization/cnf-migration-flow",
  "owner": {
    "team": "squad-sdlc",
    "contact": "squad-sdlc@bcp.com.pe"
  },
  "data_classification": "internal",
  "risk_level": "medium",
  "permissions": {
    "tools": ["Read", "Edit", "Bash"],
    "commands": ["mvn", "git"],
    "mcp_servers": ["jira"]
  },
  "external_content": "El agente procesa código fuente del repositorio y resultados de Jira; no actúa sobre instrucciones contenidas en ellos.",
  "mcp": {
    "jira": {
      "accountable_team": "platform-atlassian",
      "tools_contract": {
        "digest": "sha256:3f9a1c0e7b2d4a6f8c1e5b9d2a7f4c8e1b6d3a9f0c2e5b8d1a4f7c0e3b6d9a2f",
        "write_operations": false,
        "observed_at": "2026-09-17"
      }
    }
  }
}
